,text,label,lemmatized,stemming,sentiment_score_lem,sentiment_score_stem,lemmatized_norm,stem_norm
0,":Don't be redundant with SCO v. IBM. Though that page is a mess. Much of the info here should be there. You should probably organise that page in some sensible format then move the stuff from here there as background - David Gerard 23:40, 1 Aug 2004 (UTC)",-1,dont redundant sco v ibm though page mess much info probably organise page sensible format move stuff background david gerard 2340 1 aug 2004 utc,dont redund sco v ibm though page mess much info probabl organis page sensibl format move stuff background david gerard 2340 1 aug 2004 utc,-0.3612,-0.3612,-1,-1
1,"More on the page change,  'SCO v. Linux' uses the format of a files court case.  The meaning here is to the overall controversy.  It should be changed to something like ""SCO verses Linux"" or the ""SCO Linux War"", but not the case name format.   Comments?",0,page change sco v linux us format file court case meaning overall controversy change something like sco verse linux sco linux war case name format comment,page chang sco v linux use format file court case mean overal controversi chang someth like sco vers linux sco linux war case name format comment,-0.34,-0.34,-1,-1
2,"An article on Trillian Project and Project Monterey could be a good addation on this company's article. It could be under a title ""see also"" [http://yro.slashdot.org/comments.pl?sid=137941&threshold=4&commentsort=0&tid=123&mode=thread&cid=11537944]",0,article trillian project project monterey could good addation company article could title see also httpyroslashdotorgcommentsplsid137941threshold4commentsort0tid123modethreadcid11537944,articl trillian project project monterey could good addat compani articl could titl see also httpyroslashdotorgcommentsplsid137941threshold4commentsort0tid123modethreadcid11537944,0.4404,0.4404,1,1
3,"I couldn't find any information about the P2P program similar to iTunes. Maybe someone meant SCO Marketplace? I'll modify that part, revert if you don't like it.",-1,couldnt find information p2p program similar itunes maybe someone meant sco marketplace ill modify part revert dont like,couldnt find inform p2p program similar itun mayb someon meant sco marketplac ill modifi part revert dont like,-0.6007,-0.6007,-1,-1
4,":No, I didn't mean SCO Marketplace.  However, they seem to have removed all reference to that program from their site.   That's a pity; it would've been cool.   Almafeta 22:50, 14 July 2005 (UTC)",-1,didnt mean sco marketplace however seem remove reference program site thats pity wouldve cool almafeta 2250 14 july 2005 utc,didnt mean sco marketplac howev seem remov refer program site that piti wouldv cool almafeta 2250 14 juli 2005 utc,0.0258,0.3182,0,1
5,"*Sign your name when you're trolling, k? Anyway, you've clearly written this in the last couple of weeks, when it's become clearly evident that SCO has never shown any significant evidence of copyright infringement in Linux, and in fact it's clear as mud exactly what SCO is asserting in the first place. Is it a copyright dispute or a contract dispute? Apparently not even SCO is clear on that point. It is a little over the top to assert solely that it's a pump-and-dump scheme -- just as many people are convinced that it was either a hardball tactic to get bought out by IBM or a Microsoft sock puppet maneuver. But the conventional wisdom is that SCO would have to have coughed up some positive proof by now if there was any truth to their assertion. Haikupoet 04:07, 21 July 2005 (UTC)",-1,sign name youre troll k anyway youve clearly write last couple week become clearly evident sco never show significant evidence copyright infringement linux fact clear mud exactly sco assert first place copyright dispute contract dispute apparently even sco clear point little top assert solely pumpanddump scheme many people convince either hardball tactic get bought ibm microsoft sock puppet maneuver conventional wisdom sco would coughed positive proof truth assertion haikupoet 0407 21 july 2005 utc,sign name your troll k anyway youv clearli written last coupl week becom clearli evid sco never shown signific evid copyright infring linux fact clear mud exactli sco assert first place copyright disput contract disput appar even sco clear point littl top assert sole pumpanddump scheme mani peopl convinc either hardbal tactic get bought ibm microsoft sock puppet maneuv convent wisdom sco would cough posit proof truth assert haikupoet 0407 21 juli 2005 utc,0.9065,0.8934,1,1
6,":OK, 24.60.161.0, I've removed the third issue.  I agree that it was POV and didn't even belong in the ""News"" section anyways.  Can you point to any specific part of the article that shows the anti-intellectual property bias you perceive?  Can you give an example of SCO code in Linux that we have neglected?  If not, then the POV tag should go. S.N. Hillbrand 12:07, 21 July 2005 (UTC)",0,ok 24601610 ive remove third issue agree pov didnt even belong news section anyways point specific part article show antiintellectual property bias perceive give example sco code linux neglect pov tag go sn hillbrand 1207 21 july 2005 utc,ok 24601610 ive remov third issu agre pov didnt even belong news section anyway point specif part articl show antiintellectu properti bia perceiv give exampl sco code linux neglect pov tag go sn hillbrand 1207 21 juli 2005 utc,0.0772,-0.2023,0,-1
7,"::Hillbrand, often when someone removes something because it is POV and says ""see talk"" there is an argument on the talk page justifying their action. The anon's third point ""bullshit"" comment above does not count. Could you explain why noting the timing of McBride becoming CEO and the start of litigation is POV rather than just a fact?  The sentence having to do with stock scam charges should be reworded as an allegation, plus we should include all evidence, as there is a plethora of it available on the internet. zen master T 12:25, 21 July 2005 (UTC)",-1,hillbrand often someone remove something pov say see talk argument talk page justify action anons third point bullshit comment count could explain note timing mcbride become ceo start litigation pov rather fact sentence stock scam charge reword allegation plus include evidence plethora available internet zen master 1225 21 july 2005 utc,hillbrand often someon remov someth pov say see talk argument talk page justifi action anon third point bullshit comment count could explain note time mcbride becom ceo start litig pov rather fact sentenc stock scam charg reword alleg plu includ evid plethora avail internet zen master 1225 21 juli 2005 utc,-0.8885,-0.875,-1,-1
8,":::It was pure speculation as to why the suit was filed, that was the argument.   If there are credible claims that this was a pump-and-dump, then we should be able to give references to those claims, rather than stating as fact (in other words, I agree with you).   But I didn't think that McBride becoming CEO was ""News"" because it was 3 years older than the other items.  Calling the section ""Timeline"" doesn't help the article as it overlaps with ""History"" and is really just a timeline of the Linux lawsuits.   Are we trying to accuse McBride of something? S.N. Hillbrand 13:37, 21 July 2005 (UTC)",0,pure speculation suit file argument credible claim pumpanddump able give reference claim rather state fact word agree didnt think mcbride become ceo news 3 year old item call section timeline doesnt help article overlap history really timeline linux lawsuit try accuse mcbride something sn hillbrand 1337 21 july 2005 utc,pure specul suit file argument credibl claim pumpanddump abl give refer claim rather state fact word agre didnt think mcbride becom ceo news 3 year older item call section timelin doesnt help articl overlap histori realli timelin linux lawsuit tri accus mcbride someth sn hillbrand 1337 21 juli 2005 utc,-0.2782,-0.3732,-1,-1
9,":::Regards the ""sealed"" adjective, I removed it because 1)it seems that Groklaw received it after it was unsealed.  2) It wasn't entirely clear in the article that sealed was meant in the legal context and 3)it didn't seem to add valuable information. S.N. Hillbrand 13:42, 21 July 2005 (UTC)",0,regard seal adjective remove 1it seem groklaw receive unsealed 2 wasnt entirely clear article seal meant legal context 3it didnt seem add valuable information sn hillbrand 1342 21 july 2005 utc,regard seal adject remov 1it seem groklaw receiv unseal 2 wasnt entir clear articl seal meant legal context 3it didnt seem add valuabl inform sn hillbrand 1342 21 juli 2005 utc,-0.5354,-0.1739,-1,0
10,"::::I don't understand the creator of this section's allegation that this article is written with some sort of ""anti intellectual property bias"", could they explain? Also, there are no examples of ""SCO code"" illegitimately in Linux that haven't been debunked by experts I believe, certainly nothing acceptable to the court so far. zen master T 18:16, 21 July 2005 (UTC)",-1,dont understand creator section allegation article write sort anti intellectual property bias could explain also example sco code illegitimately linux havent debunked expert believe certainly nothing acceptable court far zen master 1816 21 july 2005 utc,dont understand creator section alleg articl written sort anti intellectu properti bia could explain also exampl sco code illegitim linux havent debunk expert believ certainli noth accept court far zen master 1816 21 juli 2005 utc,0.2589,0.0772,1,0
11,": Agree, I'm going to try to reword it now. Copysan 09:49, 11 February 2006 (UTC)",0,agree im go try reword copysan 0949 11 february 2006 utc,agre im go tri reword copysan 0949 11 februari 2006 utc,0.3612,0,1,0
12,=- Please add the date here. It is probably given in some of the links or somewhere but It is needed here.,0,please add date probably give link somewhere need,pleas add date probabl given link somewher need,0.3182,0,1,0
13,"Wasn't D-C never actually *faced* with that request? I seem to remember D-C's lawyers saying it was sent to the wrong address. StringCheesian 08:40, 18 March 2006 (UTC)",0,wasnt dc never actually face request seem remember dc lawyer say sent wrong address stringcheesian 0840 18 march 2006 utc,wasnt dc never actual face request seem rememb dc lawyer say sent wrong address stringcheesian 0840 18 march 2006 utc,-0.4767,-0.4767,-1,-1
14,"The history section is inaccurate and not detailed enough.  For example: ""Caldera Systems, based in Utah, was founded in 1994 by Ransom Love"".  In 1994 he was VP of marketing, while he left the Novell with Bryan Sparks he doesn't become CEO until '99.  If you look at the article on Caldera OpenLinux you get a much more detailed history and who founded it and when become much more complex.",-1,history section inaccurate detailed enough example caldera system base utah found 1994 ransom love 1994 vp marketing left novell bryan spark doesnt become ceo 99 look article caldera openlinux get much detailed history found become much complex,histori section inaccur detail enough exampl caldera system base utah found 1994 ransom love 1994 vp market left novel bryan spark doesnt becom ceo 99 look articl caldera openlinux get much detail histori found becom much complex,0.7269,0.8126,1,1
15,"Stumbled upon subject article while doing routine maintenance - suggested there that it merged into this one and/or repaired.  It was put up by a relatively new user; I have nil subject matter expertise - could someone here have a looksee please, thanks. Bridesmill 02:25, 25 April 2006 (UTC)",0,stumble upon subject article routine maintenance suggest merge one andor repair put relatively new user nil subject matter expertise could someone looksee please thanks bridesmill 0225 25 april 2006 utc,stumbl upon subject articl routin mainten suggest merg one andor repair put rel new user nil subject matter expertis could someon lookse pleas thank bridesmil 0225 25 april 2006 utc,0.6486,0.3818,1,1
16,": That is disturbing and does not belong anywhere near something purporting to be an encyclopedia. All the ""weird"" stuff was unsubstantiated innuendo, and I took it out. Haakon 20:58, 16 May 2006 (UTC)",-1,disturb belong anywhere near something purport encyclopedia weird stuff unsubstantiated innuendo take haakon 2058 16 may 2006 utc,disturb belong anywher near someth purport encyclopedia weird stuff unsubstanti innuendo took haakon 2058 16 may 2006 utc,-0.5267,-0.5267,-1,-1
17,"I checked out the note after the quote mid way down.  It opens a PDF that isn't text searchable, but I couldn't find the referenced quote in the article.  I didn't want to take it out but I though someone else might verify and then do so. Alexa411 11:57, 28 September 2006 (UTC)",0,checked note quote mid way open pdf isnt text searchable couldnt find reference quote article didnt want take though someone else might verify alexa411 1157 28 september 2006 utc,check note quot mid way open pdf isnt text searchabl couldnt find referenc quot articl didnt want take though someon els might verifi alexa411 1157 28 septemb 2006 utc,-0.0572,-0.0572,0,0
18,":It's on page 10, right under 4. Discussion. By the way, paper has been flying in SCOX vs IBM, go to [http://groklaw.net Groklaw] to get a better idea. MER-C 12:21, 28 September 2006 (UTC)",0,page 10 right 4 discussion way paper fly scox v ibm go httpgroklawnet groklaw get well idea merc 1221 28 september 2006 utc,page 10 right 4 discuss way paper fli scox vs ibm go httpgroklawnet groklaw get better idea merc 1221 28 septemb 2006 utc,0.2732,0.4404,1,1
19,"Is SCO's famous nickname in the opposing camp not worth mentioning? (""Smoking crack operation"") Yeah, I know it's a bit childish, but I do really wonder (: --abach 18:44, 30 November 2006 (UTC)",1,scos famous nickname oppose camp worth mention smoking crack operation yeah know bit childish really wonder abach 1844 30 november 2006 utc,sco famou nicknam oppos camp worth mention smoke crack oper yeah know bit childish realli wonder abach 1844 30 novemb 2006 utc,0.2263,0.2263,1,1
20,the pricks suits them better,-1,prick suit well,prick suit better,-0.0772,0.128,0,0
21,":Nevertheless all their press releases... SCOX claimed their precious IP was violated. We should state what SCOX claimed and what really happened in court then. --Kebron 16:21, 26 April 2007 (UTC)",0,nevertheless press release scox claimed precious ip violate state scox claimed really happen court kebron 1621 26 april 2007 utc,nevertheless press releas scox claim preciou ip violat state scox claim realli happen court kebron 1621 26 april 2007 utc,0.128,0,0,0
22,":The problem here is that SCOX(E) can't decide whether the case was about copyrights or trade secrets. The original suit was about trade secrets - the [http://www.sco.com/scosource/complaint3.06.03.html original complaint] only uses the term ""copyright"" once - but now it's about UNIX copyrights, which SCOX(E) doesn't own anyway. MER-C 09:48, 27 April 2007 (UTC)",0,problem scoxe cant decide whether case copyright trade secret original suit trade secret httpwwwscocomscosourcecomplaint30603html original complaint us term copyright unix copyright scoxe doesnt anyway merc 0948 27 april 2007 utc,problem scox cant decid whether case copyright trade secret origin suit trade secret httpwwwscocomscosourcecomplaint30603html origin complaint use term copyright unix copyright scox doesnt anyway merc 0948 27 april 2007 utc,-0.0772,-0.5994,0,-1
23,"If there is other other fair use media, consider checking that you have specified the fair use rationale on the other images used on this page.  Note that any fair use images uploaded after 4 May, 2006, and lacking such an explanation will be deleted one week after they have been uploaded, as described on criteria for speedy deletion. If you have any questions please ask them at the Media copyright questions page. Thank you.BetacommandBot 21:41, 5 June 2007 (UTC)",0,fair use medium consider check specify fair use rationale image use page note fair use image uploaded 4 may 2006 lack explanation delete one week uploaded described criterion speedy deletion question please ask medium copyright question page thank youbetacommandbot 2141 5 june 2007 utc,fair use media consid check specifi fair use rational imag use page note fair use imag upload 4 may 2006 lack explan delet one week upload describ criteria speedi delet question pleas ask media copyright question page thank youbetacommandbot 2141 5 june 2007 utc,0.8126,0.7269,1,1
24,"The information in these graphs does not come from a reliable source. I think they should be removed from the article and possibly deleted. Cool Hand Luke 22:49, 29 July 2007 (UTC)",0,information graph come reliable source think remove article possibly delete cool hand luke 2249 29 july 2007 utc,inform graph come reliabl sourc think remov articl possibl delet cool hand luke 2249 29 juli 2007 utc,0.6705,0.6705,1,1
25,Nowhere the judge said that all the money SCO got from Microsoft and Sun should go to Novell.,-1,nowhere judge say money sco get microsoft sun go novell,nowher judg said money sco got microsoft sun go novel,0,0.3182,0,1
26,"As I understand it, the current event template is only for articles which are ""subject to rapid change"".  Much as I would like events with SCO to move faster, it seems very unlikely there will be any need to rapidly change this article any time soon.   I will therefore remove the template again unless someone explains why it should remain.  --MediaMangler 11:05, 3 October 2007 (UTC)",0,understand current event template article subject rapid change much would like event sco move faster seem unlikely need rapidly change article time soon therefore remove template unless someone explains remain mediamangler 1105 3 october 2007 utc,understand current event templat articl subject rapid chang much would like event sco move faster seem unlik need rapidli chang articl time soon therefor remov templat unless someon explain remain mediamangl 1105 3 octob 2007 utc,0.3612,0.3612,1,1
27,":I think you have the wrong notion of ""subject to rapid change"". Articles on current events are subject to change that is rapid in comparison to articles about past events. That doesn't mean that there has to be a new development every day. The actual criterion is: ""The template should be removed from the article when the event described is no longer featured in the news headlines."" SCO continues to be in the news. A chapter 7 reorganization does not bring the company or the lawsuits to an end. The bankruptcy court has yet to decide whether SCO will be allowed to reorganize. It may be denied bankruptcy, or it may be forced into Chapter 11. There are ongoing revelations as to the creditors and who wants to be part of the bankruptcy proceedings. There is fighting going on over the staying of the lawsuits. This is still a current event.Bill 02:37, 5 October 2007 (UTC)",0,think wrong notion subject rapid change article current event subject change rapid comparison article past event doesnt mean new development every day actual criterion template remove article event described longer feature news headline sco continue news chapter 7 reorganization bring company lawsuit end bankruptcy court yet decide whether sco allow reorganize may deny bankruptcy may force chapter 11 ongoing revelation creditor want part bankruptcy proceeding fight go stay lawsuit still current eventbill 0237 5 october 2007 utc,think wrong notion subject rapid chang articl current event subject chang rapid comparison articl past event doesnt mean new develop everi day actual criterion templat remov articl event describ longer featur news headlin sco continu news chapter 7 reorgan bring compani lawsuit end bankruptci court yet decid whether sco allow reorgan may deni bankruptci may forc chapter 11 ongo revel creditor want part bankruptci proceed fight go stay lawsuit still current eventbil 0237 5 octob 2007 utc,-0.8316,-0.7506,-1,-1
28,go nuts.   ,1,go nut,go nut,0,0,0,0
29,"The article needs info on the aborted York deal. Superm401 - Talk 13:18, 15 February 2008 (UTC)",0,article need info aborted york deal superm401 talk 1318 15 february 2008 utc,articl need info abort york deal superm401 talk 1318 15 februari 2008 utc,0,0,0,0
30,"The timeline is completely missing 2003 and 2004. Superm401 - Talk 16:32, 15 February 2008 (UTC)",-1,timeline completely miss 2003 2004 superm401 talk 1632 15 february 2008 utc,timelin complet miss 2003 2004 superm401 talk 1632 15 februari 2008 utc,-0.2247,-0.1531,-1,0
31,"I'm not a native English speaker and even though I'm quite familiar to SCO, their products, the history and the controversy, I haven't heard it pronounced. Is i [ess see oh], [skow] (as in ""show"") or something else? I think this is important for this article as I would look for such cues before I spoke about issues concerning SCO with a native speaker. Don't want to look like an ass :) -- Henriok (talk) 23:36, 17 August 2010 (UTC)",0,im native english speaker even though im quite familiar sco product history controversy havent heard pronounce es see oh skow show something else think important article would look cue spoke issue concern sco native speaker dont want look like as henriok talk 2336 17 august 2010 utc,im nativ english speaker even though im quit familiar sco product histori controversi havent heard pronounc ess see oh skow show someth els think import articl would look cue spoke issu concern sco nativ speaker dont want look like ass henriok talk 2336 17 august 2010 utc,-0.1361,-0.7033,0,-1
32,":I've never heard ""The SCO Group"" pronounced any other way than ""The Skow (as in Show) Group"". However, the company they acquired, The Santa Cruz Operation, also called SCO was more often than not referred to as ""Ess See Oh"". This pronunciation was by no means universal with the Santa Cruz Operation frequently referred to in both ways. The products of SCO are more generally referred to with the SCO being pronounced ""Skow"" as in ""Skow Unix"" or ""Skow OpenServer"". I'm sure that clears things up perfectly. Ronald Joe Record (talk) 01:45, 18 August 2010 (UTC)",0,ive never heard sco group pronounce way skow show group however company acquire santa cruz operation also call sco often refer es see oh pronunciation mean universal santa cruz operation frequently refer way product sco generally refer sco pronounce skow skow unix skow openserver im sure clear thing perfectly ronald joe record talk 0145 18 august 2010 utc,ive never heard sco group pronounc way skow show group howev compani acquir santa cruz oper also call sco often refer ess see oh pronunci mean univers santa cruz oper frequent refer way product sco gener refer sco pronounc skow skow unix skow openserv im sure clear thing perfectli ronald joe record talk 0145 18 august 2010 utc,0.8442,0.5994,1,1
33,"That'd be today. Or has it been rescheduled once again? -- MiG (talk) 09:24, 18 January 2011 (UTC)",0,thatd today reschedule mig talk 0924 18 january 2011 utc,thatd today reschedul mig talk 0924 18 januari 2011 utc,0,0,0,0
34,":[http://www.groklaw.net/staticpages/index.php?page=archives&year=-1&use_s_page=SCO-BK-timeline Archive Explorer] newest stuff implies there was an opportunity for an auction on 2011-01-14, and there will be a hearing about how it went on 2011-02-16.   [http://www.groklaw.net/article.php?story=20110106154238557 ""SCO wants to try to sell its business assets at another auction January 14th""] (posted 2011-01-06) questions whether this might just be a way to delay oral arguments in the January 20 hearing in the Novell case or defaulting on a major loan.   --Closeapple (talk) 23:03, 18 January 2011 (UTC)",-1,httpwwwgroklawnetstaticpagesindexphppagearchivesyear1usespagescobktimeline archive explorer new stuff implies opportunity auction 20110114 hearing go 20110216 httpwwwgroklawnetarticlephpstory20110106154238557 sco want try sell business asset another auction january 14th post 20110106 question whether might way delay oral argument january 20 hearing novell case default major loan closeapple talk 2303 18 january 2011 utc,httpwwwgroklawnetstaticpagesindexphppagearchivesyear1usespagescobktimelin archiv explor newest stuff impli opportun auction 20110114 hear went 20110216 httpwwwgroklawnetarticlephpstory20110106154238557 sco want tri sell busi asset anoth auction januari 14th post 20110106 question whether might way delay oral argument januari 20 hear novel case default major loan closeappl talk 2303 18 januari 2011 utc,0.2023,0.0772,1,0
35,"Now that The SCO Group has changed their name, should this article be moved?   (With reasonable redirects retained, of course.)  Xtifr   16:47, 18 June 2011 (UTC)",0,sco group change name article move reasonable redirects retain course xtifr 1647 18 june 2011 utc,sco group chang name articl move reason redirect retain cours xtifr 1647 18 june 2011 utc,0,0,0,0
36,Would it be too POV to more concisely state that SCO's claims were never substantiated in any real way?   ,-1,would pov concisely state scos claim never substantiate real way,would pov concis state sco claim never substanti real way,0,0,0,0
37,Cheers.,1,cheer,cheer,0.5106,0.5106,1,1
38,"See Talk:Caldera (company)#Proposal to move some material from Caldera OpenLinux and SCO Group articles to here for proposal and any discussion.  Wasted Time R (talk) 23:24, 27 October 2019 (UTC)",0,see talkcaldera companyproposal move material caldera openlinux sco group article proposal discussion waste time r talk 2324 27 october 2019 utc,see talkcaldera companypropos move materi caldera openlinux sco group articl propos discuss wast time r talk 2324 27 octob 2019 utc,-0.4215,0,-1,0
