,text,label,lemmatized,stemming,sentiment_score_lem,sentiment_score_stem,lemmatized_norm,stem_norm
143,"*Comment it's times like these we need a WP:DONNASTRICKLAND policy...or maybe just a WP:MINNOW will do. LOL. The English version of the the French language title (ie ""May 68"") is by far and away the most authoritative - there are literally thousands of books, journal articles and chapters which contain simply ""May 68"" in the title. But I have more worry renaming this and replacing use of events - as per  it is a direct (and appropriate) reference to French language discussion about May 1968.  However, an [https://books.google.com/ngrams/graph?content=May+68%2CMay+1968+events&year_start=1800&year_end=2000&corpus=15&smoothing=3&share=&direct_url=t1%3B%2CMay%2068%3B%2Cc0%3B.t1%3B%2CMay%201968%20events%3B%2Cc0 NGRAM search] shows far more usage for May 68 by itself.  A [https://www.jstor.org/action/doAdvancedSearch?q0=May&f0=ti&c1=AND&q1=68&f1=ti&c2=AND&q2=&f2=all&c3=AND&q3=&f3=all&c4=AND&q4=&f4=all&c5=AND&q5=&f5=all&c6=AND&q6=&f6=all&acc=off&la=&sd=&ed=&pt=&isbn=&group=none jstor search] turns up 84 articles with May 68 alone in the title; [https://www.jstor.org/action/doBasicSearch?Query=%28ti%3A%28May%29+AND+ti%3A%2868%29+AND+ti%3A%28events%29%29 just 2 when events is added]; [https://www.jstor.org/action/doBasicSearch?Query=%28ti%3A%28May%29+AND+ti%3A%281968%29+AND+ti%3A%28events%29%29 9 with 1968 (instead of 68)] and [https://www.jstor.org/action/doBasicSearch?Query=%28ti%3A%28May%29+AND+ti%3A%281968%29+ and 184 with May 1968].--Goldsztajn (talk) 17:52, 1 November 2019 (UTC)",-1,comment time like need wpdonnastrickland policyor maybe wpminnow lol english version french language title ie may 68 far away authoritative literally thousand book journal article chapter contain simply may 68 title worry rename replace use event per direct appropriate reference french language discussion may 1968 however httpsbooksgooglecomngramsgraphcontentmay682cmay1968eventsyearstart1800yearend2000corpus15smoothing3sharedirecturlt13b2cmay20683b2cc03bt13b2cmay20196820events3b2cc0 ngram search show far usage may 68 httpswwwjstororgactiondoadvancedsearchq0mayf0tic1andq168f1tic2andq2f2allc3andq3f3allc4andq4f4allc5andq5f5allc6andq6f6allaccofflasdedptisbngroupnone jstor search turn 84 article may 68 alone title httpswwwjstororgactiondobasicsearchquery28ti3a28may29andti3a286829andti3a28events2929 2 event add httpswwwjstororgactiondobasicsearchquery28ti3a28may29andti3a28196829andti3a28events2929 9 1968 instead 68 httpswwwjstororgactiondobasicsearchquery28ti3a28may29andti3a28196829 184 may 1968goldsztajn talk 1752 1 november 2019 utc,comment time like need wpdonnastrickland policyor mayb wpminnow lol english version french languag titl ie may 68 far away authorit liter thousand book journal articl chapter contain simpli may 68 titl worri renam replac use event per direct appropri refer french languag discuss may 1968 howev httpsbooksgooglecomngramsgraphcontentmay682cmay1968eventsyearstart1800yearend2000corpus15smoothing3sharedirecturlt13b2cmay20683b2cc03bt13b2cmay20196820events3b2cc0 ngram search show far usag may 68 httpswwwjstororgactiondoadvancedsearchq0mayf0tic1andq168f1tic2andq2f2allc3andq3f3allc4andq4f4allc5andq5f5allc6andq6f6allaccofflasdedptisbngroupnon jstor search turn 84 articl may 68 alon titl httpswwwjstororgactiondobasicsearchquery28ti3a28may29andti3a286829andti3a28events2929 2 event ad httpswwwjstororgactiondobasicsearchquery28ti3a28may29andti3a28196829andti3a28events2929 9 1968 instead 68 httpswwwjstororgactiondobasicsearchquery28ti3a28may29andti3a28196829 184 may 1968goldsztajn talk 1752 1 novemb 2019 utc,0.1027,0.6486,0,1
144,"*Comment The English version of the the French language title (ie ""May 68"") is by far and away the most authoritative - there are literally thousands of books, journal articles and chapters which contain simply ""May 68"" in the title. But I have more worry renaming this and replacing use of events - as per  it is a direct (and appropriate) reference to French language discussion about May 1968.   However, an [https://books.google.com/ngrams/graph?content=May+68%2CMay+1968+events&year_start=1800&year_end=2000&corpus=15&smoothing=3&share=&direct_url=t1%3B%2CMay%2068%3B%2Cc0%3B.t1%3B%2CMay%201968%20events%3B%2Cc0 NGRAM search] shows far more usage for May 68 by itself ([https://books.google.com/ngrams/graph?content=May+68%2CMay+1968+events%2C+May+1968&year_start=1800&year_end=2000&corpus=15&smoothing=3&share=&direct_url=t1%3B%2CMay%2068%3B%2Cc0%3B.t1%3B%2CMay%201968%20events%3B%2Cc0%3B.t1%3B%2CMay%201968%3B%2Cc0 add 1968, rather than 68, and you can really see the difference]).  A [https://www.jstor.org/action/doAdvancedSearch?q0=May&f0=ti&c1=AND&q1=68&f1=ti&c2=AND&q2=&f2=all&c3=AND&q3=&f3=all&c4=AND&q4=&f4=all&c5=AND&q5=&f5=all&c6=AND&q6=&f6=all&acc=off&la=&sd=&ed=&pt=&isbn=&group=none jstor search] turns up 84 articles with May 68 alone in the title; [https://www.jstor.org/action/doBasicSearch?Query=%28ti%3A%28May%29+AND+ti%3A%2868%29+AND+ti%3A%28events%29%29 just 2 when events is added]; [https://www.jstor.org/action/doBasicSearch?Query=%28ti%3A%28May%29+AND+ti%3A%281968%29+AND+ti%3A%28events%29%29 9 with 1968 (instead of 68)] and [https://www.jstor.org/action/doBasicSearch?Query=%28ti%3A%28May%29+AND+ti%3A%281968%29+ and 184 with May 1968].--Goldsztajn (talk) 17:52, 1 November 2019 (UTC)",0,comment english version french language title ie may 68 far away authoritative literally thousand book journal article chapter contain simply may 68 title worry rename replace use event per direct appropriate reference french language discussion may 1968 however httpsbooksgooglecomngramsgraphcontentmay682cmay1968eventsyearstart1800yearend2000corpus15smoothing3sharedirecturlt13b2cmay20683b2cc03bt13b2cmay20196820events3b2cc0 ngram search show far usage may 68 httpsbooksgooglecomngramsgraphcontentmay682cmay1968events2cmay1968yearstart1800yearend2000corpus15smoothing3sharedirecturlt13b2cmay20683b2cc03bt13b2cmay20196820events3b2cc03bt13b2cmay2019683b2cc0 add 1968 rather 68 really see difference httpswwwjstororgactiondoadvancedsearchq0mayf0tic1andq168f1tic2andq2f2allc3andq3f3allc4andq4f4allc5andq5f5allc6andq6f6allaccofflasdedptisbngroupnone jstor search turn 84 article may 68 alone title httpswwwjstororgactiondobasicsearchquery28ti3a28may29andti3a286829andti3a28events2929 2 event add httpswwwjstororgactiondobasicsearchquery28ti3a28may29andti3a28196829andti3a28events2929 9 1968 instead 68 httpswwwjstororgactiondobasicsearchquery28ti3a28may29andti3a28196829 184 may 1968goldsztajn talk 1752 1 november 2019 utc,comment english version french languag titl ie may 68 far away authorit liter thousand book journal articl chapter contain simpli may 68 titl worri renam replac use event per direct appropri refer french languag discuss may 1968 howev httpsbooksgooglecomngramsgraphcontentmay682cmay1968eventsyearstart1800yearend2000corpus15smoothing3sharedirecturlt13b2cmay20683b2cc03bt13b2cmay20196820events3b2cc0 ngram search show far usag may 68 httpsbooksgooglecomngramsgraphcontentmay682cmay1968events2cmay1968yearstart1800yearend2000corpus15smoothing3sharedirecturlt13b2cmay20683b2cc03bt13b2cmay20196820events3b2cc03bt13b2cmay2019683b2cc0 add 1968 rather 68 realli see differ httpswwwjstororgactiondoadvancedsearchq0mayf0tic1andq168f1tic2andq2f2allc3andq3f3allc4andq4f4allc5andq5f5allc6andq6f6allaccofflasdedptisbngroupnon jstor search turn 84 articl may 68 alon titl httpswwwjstororgactiondobasicsearchquery28ti3a28may29andti3a286829andti3a28events2929 2 event ad httpswwwjstororgactiondobasicsearchquery28ti3a28may29andti3a28196829andti3a28events2929 9 1968 instead 68 httpswwwjstororgactiondobasicsearchquery28ti3a28may29andti3a28196829 184 may 1968goldsztajn talk 1752 1 novemb 2019 utc,-0.5994,0,-1,0
145,"* Support May 68 (or May '68 with apostrophe, if that is somehow better) per common usage in sources (and my comment above) with a hatnote to the standard and global May 1968. I'd even argue that ""May 1968"" more often refers to the French events/unrest than the month itself but I don't know what cascading problems that would cause with templates and whatnot. There are several English-language books published before the rise of Wikipedia that refer to this topic as simply ""May 68"" (no apostrophe). Secondarily, I think France in May 1968 is preferable to May 1968 in France as natural disambiguation, given that we're talking about a time in a place and not a place in a time. I'm not necessarily opposed to the other proposals, but I think this is just a matter of whether we can feasibly use the terms that our sources indeed use.  14:35, 3 November 2019 (UTC)",0,support may 68 may 68 apostrophe somehow well per common usage source comment hatnote standard global may 1968 id even argue may 1968 often refers french eventsunrest month dont know cascade problem would cause template whatnot several englishlanguage book publish rise wikipedia refer topic simply may 68 apostrophe secondarily think france may 1968 preferable may 1968 france natural disambiguation give talk time place place time im necessarily oppose proposal think matter whether feasibly use term source indeed use 1435 3 november 2019 utc,support may 68 may 68 apostroph somehow better per common usag sourc comment hatnot standard global may 1968 id even argu may 1968 often refer french eventsunrest month dont know cascad problem would caus templat whatnot sever englishlanguag book publish rise wikipedia refer topic simpli may 68 apostroph secondarili think franc may 1968 prefer may 1968 franc natur disambigu given talk time place place time im necessarili oppos propos think matter whether feasibl use term sourc inde use 1435 3 novemb 2019 utc,0.7398,0.7881,1,1
146,"* While I understand the rationale for a move to }} (with or without an apostrophe), it seems to fail at least two naming criteria in being less recognizable for English readers and easily confused with the topic  in general. I'm open to being persuaded otherwise, but this just seems too ambiguous. â€”Sangdeboeuf (talk) 11:34, 10 November 2019 (UTC)",-1,understand rationale move without apostrophe seem fail least two name criterion less recognizable english reader easily confuse topic general im open persuade otherwise seem ambiguous â€ ” sangdeboeuf talk 1134 10 november 2019 utc,understand rational move without apostroph seem fail least two name criteria less recogniz english reader easili confus topic gener im open persuad otherwis seem ambigu â€ ” sangdeboeuf talk 1134 10 novemb 2019 utc,0.5187,0.431,1,1
147,"*Support May 68 â€“ The ngram data is very clear and conclusive. [https://books.google.com/ngrams/graph?content=May+1968+in+France%2CFrance+in+May+1968%2CMay+68&year_start=1800&year_end=2008&corpus=15&smoothing=3 See ngram here]. ---Â  19:16, 11 November 2019 (UTC)",0,support may 68 â€ “ ngram data clear conclusive httpsbooksgooglecomngramsgraphcontentmay1968infrance2cfranceinmay19682cmay68yearstart1800yearend2008corpus15smoothing3 see ngram â 1916 11 november 2019 utc,support may 68 â€ “ ngram data clear conclus httpsbooksgooglecomngramsgraphcontentmay1968infrance2cfranceinmay19682cmay68yearstart1800yearend2008corpus15smoothing3 see ngram â 1916 11 novemb 2019 utc,0.6486,0.6486,1,1
148,"*: Obviously a generic construction such as May 68 is going to return more results than a more focused one such as May 1968 in France. We don't know how many of those hits are about the topic; I suspect many are false positives, such as dates of [https://books.google.com/books/about/Cumulated_Index_Medicus.html?id=VKaAXoEedVYC&q=%22may+68%22 published] [https://books.google.com/books/about/Toxicity_Bibliography.html?id=2PBWiQnvvgAC&q=%22may+68%22 papers], other [https://books.google.com/books/about/Consumer_Bulletin.html?id=4DfVAAAAMAAJ&q=%22may+68%22 generic] [https://books.google.com/books/about/Directory_of_Chinese_Communist_Leadershi.html?id=vR3jAAAAMAAJ&q=%22may+68%22 date] [https://books.google.com/books/about/Department_of_Defense_Appropriations_for.html?id=_vNBAJ_sl2cC&q=%22may+68%22 entries], or accidental couplings such as [https://books.google.com/books/about/Investigation_Disposition_of_Surplus_Pro.html?id=y3VgK5c6CEgC&q=%22may+68%22 ""...for April and May. 68 tons of these are required...""], etc. â€”Sangdeboeuf (talk) 01:17, 12 November 2019 (UTC)",0,obviously generic construction may 68 go return result focus one may 1968 france dont know many hit topic suspect many false positive date httpsbooksgooglecombooksaboutcumulatedindexmedicushtmlidvkaaxoeedvycq22may6822 publish httpsbooksgooglecombooksabouttoxicitybibliographyhtmlid2pbwiqnvvgacq22may6822 paper httpsbooksgooglecombooksaboutconsumerbulletinhtmlid4dfvaaaamaajq22may6822 generic httpsbooksgooglecombooksaboutdirectoryofchinesecommunistleadershihtmlidvr3jaaaamaajq22may6822 date httpsbooksgooglecombooksaboutdepartmentofdefenseappropriationsforhtmlidvnbajsl2ccq22may6822 entry accidental coupling httpsbooksgooglecombooksaboutinvestigationdispositionofsurplusprohtmlidy3vgk5c6cegcq22may6822 april may 68 ton require etc â€ ” sangdeboeuf talk 0117 12 november 2019 utc,obvious gener construct may 68 go return result focus one may 1968 franc dont know mani hit topic suspect mani fals posit date httpsbooksgooglecombooksaboutcumulatedindexmedicushtmlidvkaaxoeedvycq22may6822 publish httpsbooksgooglecombooksabouttoxicitybibliographyhtmlid2pbwiqnvvgacq22may6822 paper httpsbooksgooglecombooksaboutconsumerbulletinhtmlid4dfvaaaamaajq22may6822 gener httpsbooksgooglecombooksaboutdirectoryofchinesecommunistleadershihtmlidvr3jaaaamaajq22may6822 date httpsbooksgooglecombooksaboutdepartmentofdefenseappropriationsforhtmlidvnbajsl2ccq22may6822 entri accident coupl httpsbooksgooglecombooksaboutinvestigationdispositionofsurplusprohtmlidy3vgk5c6cegcq22may6822 april may 68 ton requir etc â€ ” sangdeboeuf talk 0117 12 novemb 2019 utc,0.2732,-0.6486,1,-1
149,"*::I am pretty sure if someone types in ""May 68"", they are very very likely looking for this particular subject and no other. I see no other more common name. There is also [https://tools.wmflabs.org/pageviews/?project=en.wikipedia.org&platform=all-access&agent=userâ¦Ą=latest-90&pages=May_1968|May_1968_events_in_France a strong argument] for WP:PRIMARYTOPIC for this topic.---Â  13:46, 14 November 2019 (UTC)",0,pretty sure someone type may 68 likely look particular subject see common name also httpstoolswmflabsorgpageviewsprojectenwikipediaorgplatformallaccessagentuserâ¦ąlatest90pagesmay1968may1968eventsinfrance strong argument wpprimarytopic topicâ 1346 14 november 2019 utc,pretti sure someon type may 68 like look particular subject see common name also httpstoolswmflabsorgpageviewsprojectenwikipediaorgplatformallaccessagentuserâ¦ąlatest90pagesmay1968may1968eventsinfr strong argument wpprimarytop topicâ 1346 14 novemb 2019 utc,0.743,0.6808,1,1
150,"*::: That's possible, but I don't see what it has to do with the NGram data. Whether the topic is primary is only one consideration. For the general reader, I think naturalness and recognizability are more important. â€”Sangdeboeuf (talk) 00:03, 15 November 2019 (UTC)",0,thats possible dont see ngram data whether topic primary one consideration general reader think naturalness recognizability important â€ ” sangdeboeuf talk 0003 15 november 2019 utc,that possibl dont see ngram data whether topic primari one consider gener reader think natur recogniz import â€ ” sangdeboeuf talk 0003 15 novemb 2019 utc,0.2023,0,1,0
151,"*::::It seems good enough for the titles of several books about the subject: https://www.google.com/search?q=intitle:%22may+68%22&tbm=bks#=100. I think that shows that ""May 68"" meets naturalness and recognizability. I am not see as many book titles with ""May 1968"": https://www.google.com/search?q=intitle:%22may+1968%22&tbm=bks#=100. I am only offering alternative theories why I think May 68 is the better title. Your counter arguments are valid. I am not refuting them. I am only saying that from a holistic view of sources and arguments offered, I am personally convinced that ""May 68"" ticks the most boxes at WP:CRITERIA. ---Â  12:16, 15 November 2019 (UTC)",0,seem good enough title several book subject httpswwwgooglecomsearchqintitle22may6822tbmbks100 think show may 68 meet naturalness recognizability see many book title may 1968 httpswwwgooglecomsearchqintitle22may196822tbmbks100 offering alternative theory think may 68 well title counter argument valid refute say holistic view source argument offer personally convince may 68 tick box wpcriteria â 1216 15 november 2019 utc,seem good enough titl sever book subject httpswwwgooglecomsearchqintitle22may6822tbmbks100 think show may 68 meet natur recogniz see mani book titl may 1968 httpswwwgooglecomsearchqintitle22may196822tbmbks100 offer altern theori think may 68 better titl counter argument valid refut say holist view sourc argument offer person convinc may 68 tick box wpcriteria â 1216 15 novemb 2019 utc,0.25,0.2023,1,1
152,:The above discussion is preserved as an archive of a requested move.    Subsequent comments should be made in a new section on this talk page. No further edits should be made to this section.,-1,discussion preserve archive request move subsequent comment make new section talk page edits make section,discuss preserv archiv request move subsequ comment made new section talk page edit made section,0,0,0,0
153,"Just browsing here from another article, is there any reason why the flags of the different sides have a different shade of blue? This hasn't been mentioned in the archive. I don't know if there was any difference between the two, and if there was, it's hardly as distinct as the flags of the two ideological sides in 20th-century Spain, or the two sides in modern Belarus. Unknown Temptation (talk) 19:27, 22 September 2021 (UTC)",0,browsing another article reason flag different side different shade blue hasnt mention archive dont know difference two hardly distinct flag two ideological side 20thcentury spain two side modern belarus unknown temptation talk 1927 22 september 2021 utc,brows anoth articl reason flag differ side differ shade blue hasnt mention archiv dont know differ two hardli distinct flag two ideolog side 20thcenturi spain two side modern belaru unknown temptat talk 1927 22 septemb 2021 utc,0,0,0,0
154,":Dang! that's irritating! I've made a redirect from Artemision and some links at Ephesus. --Wetman 19:44, 1 Mar 2005 (UTC)",-1,dang thats irritate ive make redirect artemision link ephesus wetman 1944 1 mar 2005 utc,dang that irrit ive made redirect artemis link ephesu wetman 1944 1 mar 2005 utc,-0.4215,0,-1,0
155,"I removed the Ptolemy reference (""Ptolemy, 5""), or actually, commented it out, because (a) it's not enough of a reference â€” which work of his? â€” and (b)Â IÂ couldn't find any reference to the Artemision in those works of his IÂ do have at hand: the Geography, the Optics, the Tetrabiblos. The closest, and IÂ suspect the origin of the vague reference, was a bald listing of Ephesus with its coĂ¶rdinates in the [http://penelope.uchicago.edu/Thayer/E/Gazetteer/Periods/Roman/_Texts/Ptolemy/5/2*.html#Ephesus Geography, V.2], but no mention there of the Artemision. I'm quite prepared to stand corrected of course if you guys find the elusive citation. â€”Â Bill 14:46, 2 Mar 2005 (UTC)",-1,remove ptolemy reference ptolemy 5 actually comment enough reference â€ ” work â€ ” bâ iâ couldnt find reference artemision work iâ hand geography optic tetrabiblos closest iâ suspect origin vague reference bald listing ephesus coă¶rdinates httppenelopeuchicagoeduthayeregazetteerperiodsromantextsptolemy52htmlephesus geography v2 mention artemision im quite prepared stand correct course guy find elusive citation â€ ” â bill 1446 2 mar 2005 utc,remov ptolemi refer ptolemi 5 actual comment enough refer â€ ” work â€ ” bâ iâ couldnt find refer artemis work iâ hand geographi optic tetrabiblo closest iâ suspect origin vagu refer bald list ephesu coă¶rdin httppenelopeuchicagoeduthayeregazetteerperiodsromantextsptolemy52htmlephesu geographi v2 mention artemis im quit prepar stand correct cours guy find elus citat â€ ” â bill 1446 2 mar 2005 utc,0.4201,0.25,1,1
156,":Bill, thanks for the contribution.  However, it appears that you've accidentally copied the text twice at different places, the second copy usually bearing your changes.  I will now delete the extra text while keeping the changes you've made.  Please check if your changes remain after I edit. Phaust 17:39, Mar 2, 2005 (UTC)",0,bill thanks contribution however appear youve accidentally copy text twice different place second copy usually bearing change delete extra text keep change youve make please check change remain edit phaust 1739 mar 2 2005 utc,bill thank contribut howev appear youv accident copi text twice differ place second copi usual bear chang delet extra text keep chang youv made pleas check chang remain edit phaust 1739 mar 2 2005 utc,0.4215,-0.1531,1,0
157,Did the ancient building techniques include something like lead in the mortar which might have melted under a fire's heat? Can anyone offer a good link or explanation on how this would have reduced the building to rubble?,0,ancient building technique include something like lead mortar might melt fire heat anyone offer good link explanation would reduce building rubble,ancient build techniqu includ someth like lead mortar might melt fire heat anyon offer good link explan would reduc build rubbl,0.4588,0.4588,1,1
158,":Unlike buildings made of granite for example, marble buildings burn. Marble is a form of limestone, and limestone burns quite easily: making quicklime, whence the name limestone. In a first stage it cracks into small fragments. You are right of course that something, like furnishings, wood, lead, is needed to get the fire going.  â€”Â Bill 19:14, 22 Mar 2005 (UTC)",0,unlike building make granite example marble building burn marble form limestone limestone burn quite easily make quicklime whence name limestone first stage crack small fragment right course something like furnishing wood lead need get fire go â€ ” â bill 1914 22 mar 2005 utc,unlik build made granit exampl marbl build burn marbl form limeston limeston burn quit easili make quicklim whenc name limeston first stage crack small fragment right cours someth like furnish wood lead need get fire go â€ ” â bill 1914 22 mar 2005 utc,0.4201,0.0258,1,0
159,":I belive Strabo or Pliny noted that Herostratus set fire to the frame of the temple roof, which was made of wood. Phaust",0,belive strabo pliny note herostratus set fire frame temple roof make wood phaust,beliv strabo plini note herostratu set fire frame templ roof made wood phaust,-0.34,-0.34,-1,-1
160,":Thanks, gents. Those are both very useful! I looked up Calcium Oxide and Calcium Carbonate, and it confirms what Bill said. Virosa 22:44, 22 Mar 2005 (UTC)",1,thanks gent useful look calcium oxide calcium carbonate confirms bill say virosa 2244 22 mar 2005 utc,thank gent use look calcium oxid calcium carbon confirm bill said virosa 2244 22 mar 2005 utc,0.7003,0.3612,1,1
161,"::Plus our illustration shows the Crusader castle lurking on the hilltop. Ready-dressed stone was always at hand when pagan buildings were quarries for Christians. --Wetman 03:57, 23 Mar 2005 (UTC)",0,plus illustration show crusader castle lurk hilltop readydressed stone always hand pagan building quarry christian wetman 0357 23 mar 2005 utc,plu illustr show crusad castl lurk hilltop readydress stone alway hand pagan build quarri christian wetman 0357 23 mar 2005 utc,0.34,0.34,1,1
162,"New edit: ""...was built around 550 BC at Ephesus (present day Turkey) during the Achaemenid Persian period... How sensible is this? Or is this just Third World Acting Up?--Wetman 07:31, 8 October 2005 (UTC)",0,new edit built around 550 bc ephesus present day turkey achaemenid persian period sensible third world act upwetman 0731 8 october 2005 utc,new edit built around 550 bc ephesu present day turkey achaemenid persian period sensibl third world act upwetman 0731 8 octob 2005 utc,0,0,0,0
163,"Those aren't breasts. They're aurochs' testicles. --Fulminouscherub 22:08, 7 November 2005 (UTC)",0,arent breast theyre aurochs testicle fulminouscherub 2208 7 november 2005 utc,arent breast theyr auroch testicl fulminouscherub 2208 7 novemb 2005 utc,0,0,0,0
164,"Interestingly, Mary, mother of Jesus, retired in Ephesus. Thus, even with the passing of the pagan era, Ephesus remains a center of virgin goddess worship. --Fulminouscherub 22:21, 7 November 2005 (UTC)",0,interestingly mary mother jesus retire ephesus thus even passing pagan era ephesus remains center virgin goddess worship fulminouscherub 2221 7 november 2005 utc,interestingli mari mother jesu retir ephesu thu even pass pagan era ephesu remain center virgin goddess worship fulminouscherub 2221 7 novemb 2005 utc,0.5994,0.296,1,1
